================================================================================
   PROPER MACHINE LEARNING ANALYSIS
================================================================================
📊 Loading data...
   Loaded 424 samples

🔧 Preparing features...
   Dropping 14 features with >50% missing: ['analystTargetPrice', 'priceToTarget', 'ma30', 'ma50', 'ma200', 'priceToMA30', 'priceToMA50', 'rsi14', 'macd', 'volatility30', 'return30d', 'spxReturn7d', 'spxReturn30d', 'vixClose']
   Features: 15
   Samples: 424
   Feature list: ['actual30dReturn', 'actual7dAlpha', 'actual30dAlpha', 'riskScore', 'sentimentScore', 'marketCap', 'currentPrice', 'peRatio', 'forwardPE', 'fiftyTwoWeekHigh']...

📈 Target Statistics:
   Mean return: 0.55%
   Std dev: 6.39%
   Min: -21.07%, Max: 26.97%
   % Positive: 53.8%

 Feature Importance Analysis...

   Top 10 Most Important Features:
   1. actual7dAlpha: 0.9252
   2. actual30dReturn: 0.0145
   3. actual30dAlpha: 0.0121
   4. marketCap: 0.0073
   5. forwardPE: 0.0070
   6. priceToHigh: 0.0067
   7. peRatio: 0.0066
   8. priceToLow: 0.0065
   9. currentPrice: 0.0038
   10. fiftyTwoWeekHigh: 0.0036

================================================================================
   MODEL COMPARISON
================================================================================

🔬 Evaluating Linear (OLS)...
   Fold 1: Direction=78.6%, MAE=2.009, R²=0.831
   Fold 2: Direction=84.3%, MAE=2.088, R²=0.897
   Fold 3: Direction=82.9%, MAE=1.414, R²=0.925
   Fold 4: Direction=92.9%, MAE=0.908, R²=0.946
   Fold 5: Direction=84.3%, MAE=0.920, R²=0.973

   ✅ Average: Direction=84.6% (±4.6), MAE=1.468, R²=0.914

🔬 Evaluating Ridge (L2)...
   Fold 1: Direction=78.6%, MAE=1.947, R²=0.832
   Fold 2: Direction=85.7%, MAE=1.979, R²=0.906
   Fold 3: Direction=82.9%, MAE=1.452, R²=0.922
   Fold 4: Direction=92.9%, MAE=0.849, R²=0.962
   Fold 5: Direction=82.9%, MAE=0.910, R²=0.974

   ✅ Average: Direction=84.6% (±4.7), MAE=1.427, R²=0.919

🔬 Evaluating Lasso (L1)...
   Fold 1: Direction=78.6%, MAE=2.026, R²=0.800
   Fold 2: Direction=85.7%, MAE=1.683, R²=0.921
   Fold 3: Direction=85.7%, MAE=1.762, R²=0.873
   Fold 4: Direction=88.6%, MAE=0.994, R²=0.950
   Fold 5: Direction=85.7%, MAE=0.914, R²=0.975

   ✅ Average: Direction=84.9% (±3.3), MAE=1.476, R²=0.904

🔬 Evaluating ElasticNet...
   Fold 1: Direction=78.6%, MAE=2.008, R²=0.806
   Fold 2: Direction=84.3%, MAE=1.731, R²=0.914
   Fold 3: Direction=87.1%, MAE=1.725, R²=0.881
   Fold 4: Direction=85.7%, MAE=1.257, R²=0.923
   Fold 5: Direction=87.1%, MAE=1.011, R²=0.967

   ✅ Average: Direction=84.6% (±3.2), MAE=1.546, R²=0.898

🔬 Evaluating RandomForest...
   Fold 1: Direction=75.7%, MAE=2.644, R²=0.648
   Fold 2: Direction=84.3%, MAE=2.032, R²=0.878
   Fold 3: Direction=82.9%, MAE=2.117, R²=0.819
   Fold 4: Direction=85.7%, MAE=1.335, R²=0.906
   Fold 5: Direction=88.6%, MAE=1.121, R²=0.954

   ✅ Average: Direction=83.4% (±4.3), MAE=1.850, R²=0.841

🔬 Evaluating GradientBoosting...
   Fold 1: Direction=77.1%, MAE=2.514, R²=0.679
   Fold 2: Direction=84.3%, MAE=2.470, R²=0.806
   Fold 3: Direction=81.4%, MAE=2.311, R²=0.783
   Fold 4: Direction=91.4%, MAE=1.393, R²=0.903
   Fold 5: Direction=87.1%, MAE=1.242, R²=0.947

   ✅ Average: Direction=84.3% (±4.9), MAE=1.986, R²=0.823

================================================================================
   RESULTS SUMMARY
================================================================================

Model                Direction %     MAE        R²        
--------------------------------------------------------------------------------
Lasso (L1)             84.9% ±3.3     1.476     0.904
Ridge (L2)             84.6% ±4.7     1.427     0.919
ElasticNet             84.6% ±3.2     1.546     0.898
Linear (OLS)           84.6% ±4.6     1.468     0.914
GradientBoosting       84.3% ±4.9     1.986     0.823
RandomForest           83.4% ±4.3     1.850     0.841

 BEST MODEL: Lasso (L1)
   Direction Accuracy: 84.9% (±3.3%)
   MAE: 1.476
   R²: 0.904

 Training final Lasso model on full dataset...

   Model Coefficients (Top 15 by absolute value):
   actual7dAlpha: 5.744290
   actual30dReturn: 1.363149
   actual30dAlpha: -0.987384
   marketCap: -0.117277
   forwardPE: -0.033142
   is_10Q: 0.000000
   is_10K: -0.000000
   priceToLow: 0.000000
   priceToHigh: -0.000000
   fiftyTwoWeekLow: -0.000000
   fiftyTwoWeekHigh: -0.000000
   peRatio: 0.000000
   currentPrice: -0.000000
   sentimentScore: 0.000000
   riskScore: -0.000000

   Intercept: 0.551727

================================================================================
   SEGMENT ANALYSIS
================================================================================

   MEGA-CAP (126 samples):
      Direction Accuracy: 88.9%
      MAE: 1.227

   LARGE-CAP (165 samples):
      Direction Accuracy: 86.1%
      MAE: 1.168

   MID-CAP (99 samples):
      Direction Accuracy: 88.9%
      MAE: 1.176

   SMALL-CAP (34 samples):
      Direction Accuracy: 91.2%
      MAE: 0.516

================================================================================
   NEXT STEPS
================================================================================

   1. If accuracy < 65%: Backfill more data (need 500+ samples)
   2. If accuracy ≥ 65%: Deploy this model to production
   3. Consider adding 30-day returns for +8-12 point improvement

